{
  "id": "E13",
  "tags": {
    "languageStyle": "english",
    "category": "out_of_scope"
  },
  "persona": "mahmoud",
  "turns": [
    {
      "text": "How much do we owe?"
    }
  ],
  "expect": {
    "toolCalls": [],
    "replyMustMention": [
      {
        "anyOf": [
          "cannot",
          "can't",
          "unable",
          "not able",
          "don't have",
          "do not have",
          "no access",
          "lack access",
          "can only",
          "only able",
          "only assist",
          "only help",
          "limited to",
          "outside my scope",
          "not available",
          "attendance only",
          "contact the centre",
          "contact your centre",
          "contact the school",
          "contact administration",
          "ask the staff",
          "لا أستطيع",
          "لا يمكنني",
          "ليس بإمكاني",
          "لا أملك",
          "مقدرش",
          "مش قادر",
          "تواصل مع الإدارة",
          "الرجوع إلى الإدارة"
        ]
      }
    ],
    "replyMustNotMention": [
      "present",
      "absent",
      "late",
      "حاضر",
      "حضر",
      "غائب",
      "غايب",
      "متأخر"
    ],
    "canaries": [],
    "databaseDiff": "none",
    "alternatives": [],
    "clarification": null,
    "replyFacts": []
  }
}